Name,Auto number,Program check,Program name,Type of Opportunity,Annual scholarship?,Study level,Host Country,Discipline,Value,Note,Link,Deadline?,Date updated,Checked?
,357,,,,,,,,,,,,,
,1439,,,,,,Norway,,,,,,,
Aarhus BS,1231,,Aarhus BS,University-sponsor Scholarship,checked,Master,Denmark,Business and finance,"less than 50% tuition fee ,100% tuition fee",,http://bss.au.dk/en/programmes/master/,October,20/9/2017,
Amandus H. Lundqvist Scholarship Program,580,,Amandus H. Lundqvist Scholarship Program,University-sponsor Scholarship,checked,Master,Netherland,A LOT OF DISCIPLINES,Full scholarship,Continuation of the scholarship during the two years of the Master's program depends on the academic achievements of the student. The student’s academic results will be assessed in the spring following the start of the program.,https://www.tue.nl/en/studeren/studying-at-tue/study-costs-scholarships-and-grants/scholarships-and-grants/amandus-h-lundqvist-scholarship-program/,Febuary,19/8/2017,
Art Major Asian(AMA) Scholarship,314,,Art Major Asian(AMA) Scholarship,University-sponsor Scholarship,checked,"Undergraduate ,Master ",South Korea,"""Arts, Design and Photography""",Full scholarship,Ứng viên cần có tài năng về nghệ thuật vượt trội,http://karts.ac.kr:8090/?MID=htmlContent&IDX=375,June,18/8/2017,
ASEAN International Mobility for Students (AIMS) programme,1232,,ASEAN International Mobility for Students (AIMS) programme,Exchange scholarship,checked,Undergraduate,South Korea,A LOT OF DISCIPLINES,Nearly full scholarship (withour air tickets or accommodation),"- Tùy trường bạn apply mới có học bổng này
- Phải viết luận nhưng không phỏng vấn",http://rihed.seameo.org/programmes/aims/,January,20/9/2017,
Carleton University Entrance Awards for International Students,1240,,Carleton University Entrance Awards for International Students,University-sponsor Scholarship,checked,Undergraduate,Canada,A LOT OF DISCIPLINES,50% tuition fee,Giá trị từ 4000 CAD đến 16000 CAD. Sinh viên phải được nhận vào trường với kết quả đạt trên 80% tiêu chuẩn đầu vào cũng như đảm bảo được yêu cầu về ngoại ngữ.,https://carleton.ca/awards/scholarships/entrance-scholarships-for-new-students/scholarships/,October,20/9/2017,
Endeavour Postgraduate Scholarship,502,,Endeavour Postgraduate Scholarship,Government Scholarship,checked,"Post-graduate ,PhD ",Australia,A LOT OF DISCIPLINES,Full scholarship,Tuition fee tối đa là 15000 USD/học kỳ. Khoá học mà người apply chọn có tuition fee một kỳ vượt quá mức nêu trên thì người apply sẽ phải cam kết tự chi trả phần tuition fee vượt quá đó/hoặc lựa chọn một khoá học khác có tuition fee nằm trong hạn mức của học bổng.,https://internationaleducation.gov.au/endeavour%20program/scholarships-and-fellowships/international-applicants/pages/international-applicants.aspx,June,19/8/2017,
Forté Fellowships,1368,,Forté Fellowships,Fellowship Scholarship,checked,Master,United State,Business and finance,"100% tuition fee,50% tuition fee ","Candidates should exhibit exemplary leadership in one or more ways: academic leadership, team leadership, community leadership, and creative leadership.
Candidates should demonstrate a commitment to women and girls via personal mentorship or community involvement. Such commitment is in alignment with the mission of Forté Foundation.
Schools are encouraged to nominate fellows from their schools who represent diverse educational and work backgrounds, career goals, ethnicities and citizenship.",http://www.fortefoundation.org/site/PageServer?pagename=premba_fellows#.WeTih4-CzZ4,January,17/10/2017,
Học Bổng Tiến Sĩ Và Sau Tiến Sĩ Tại Đại Học Texas 2018-2019,527,,Học Bổng Tiến Sĩ Và Sau Tiến Sĩ Tại Đại Học Texas 2018-2019,University-sponsor Scholarship,,PhD,United State,A LOT OF DISCIPLINES,50% tuition fee,Học bổng còn dành cho cả bậc sau Tiến Sĩ,http://www.hrc.utexas.edu/research/fellowships/application/,Change every year,19/8/2017,
Học Bổng Toàn Phần Tiến Sĩ Dành Cho Sinh Viên Quốc Tế Tại Chosun University,1321,,Học Bổng Toàn Phần Tiến Sĩ Dành Cho Sinh Viên Quốc Tế Tại Chosun University,University-sponsor Scholarship,checked,PhD,South Korea,Computer science and IT,100% tuition fee,,http://asic.chosun.ac.kr,November,30/9/2017,
Hong Kong PhD Fellowship,1063,Hong Kong PhD Fellowship Scheme for International Students,Hong Kong PhD Fellowship,Fellowship Scholarship,,PhD,Hong Kong,A LOT OF DISCIPLINES,Full scholarship,"Đây là học bổng PhD tại 8 trường đại học hàng đầu Hong Kong, tùy thuộc vào từng trường mà số tiền tài trợ khác nhau. Nhìn chung, người đạt học bổng sẽ được cấp chi phí nghiên cứu, sinh hoạt, tham gia hội nghị khoa học và tiền thưởng nếu đạt thành tích tốt.",https://l.facebook.com/l.php?u=https%3A%2F%2Fcerg1.ugc.edu.hk%2Fhkpfs%2Fapply.html&h=ATPv3dzyqcA_AxTj_UgvBdEX9q5yG_O9GvKc6eCDvD0Cnf5gf1puzlmEsdmdrPs0ttY9Xknyx9OgT7K4YYuQCKZu9bm5n5M-nEKzlYVNz-6Kup1ny4YGNGNDEL6EB-yWSznxb97l1nG-_li9cC1Phd83LUNXz89pYoT7TOjQZoVel096YThX8sJl-3Xv59HDTXGtFT7ViXisImEaBJxBpz6ugPZMh4TBzKF1BsaWyxUHR2uWG0h-qqaxnqA8RBev7f2sRaTFBiZtEeKaD8mRlQ,December,5/9/2017,
HVIET summer camp for high school students,618,,HVIET summer camp for high school students,Conference Scholarship,checked,High school,Vietnam,A LOT OF DISCIPLINES,"50% tuition fee ,100% tuition fee,less than 50% tuition fee ","Học bổng này dành cho các bạn học sinh cấp 3. Tuy nhiên những bạn học năm 1,2 đại học muốn tham gia cũng được.
Học bổng maximum là 10 triệu cho 10 ngày traị hè.
Các bạn nên cố gắng viết bài luận tốt và có một vài thành tích cá nhân thì sẽ có khả năng nhận được học bổng toàn phần.",http://www.hviet.com/,April,20/8/2017,
Institute of Design and Architecture Scholarships,330,,Institute of Design and Architecture Scholarships,University-sponsor Scholarship,checked,"Post-graduate ,Master ",Italy,"""Arts, Design and Photography""",50% tuition fee,,http://isad-school.com/scholarships,September,18/8/2017,
Kawaguchi Shizu Memorial Scholarship (The Asian Foundation for International Scholarship Interchange),957,,Kawaguchi Shizu Memorial Scholarship (The Asian Foundation for International Scholarship Interchange),Company-sponsor Scholarship,checked,"Undergraduate ,Master ,PhD ",Japan,A LOT OF DISCIPLINES,Cash award,"*REQUIREMENT
 1)	Privately financed international students from Asian countries who are studying at, or allowed to be enrolled in a graduate school in Japan as a regular student with college visa status.
(2)	Those who are 34 years old or younger at the time of application.
(3)	Those who have good academic performance, and need a financial assistance.
(4)	Those who do not receive other scholarships.
(5)	Those who have Japanese language proficiency certificate TOPJ with advanced C level (JLPT with a similar level also accepted).

*SCHOLARSHIP
Undergraduates and master's students, 60,000 for a month. Doctoral students, 70,000 yen for a month",http://www.asian-foundation.org/scholarship/japanese.php,"January,December",5/9/2017,
" Ludwig-Maximilian University of Munich Doctoral Scholarships for International Students in Germany, 2017",1385,," Ludwig-Maximilian University of Munich Doctoral Scholarships for International Students in Germany, 2017",University-sponsor Scholarship,checked,PhD,Germany,A LOT OF DISCIPLINES,Cash award,,http://www.en.uni-muenchen.de/about_lmu/contact/int_office/services/services_incomings/support_for_all_incomings/scholarships/scholarships_for_incomings/lmu_scholarship/index.html,June,28/11/2017,
Master’s Degree Program JFY 2018,877,,Master’s Degree Program JFY 2018,Government Scholarship,checked,Master,Japan,A LOT OF DISCIPLINES,Full scholarship,"Để nộp đơn xin học bổng cần đạt ít nhất 1 trong các yêu cầu sau: xếp hạng tốt nghiệp hoặc điểm trong năm gần nhất nằm trong top 15% của lớp; có điểm GPA ít nhất 3.0 trên 4 hoặc 7.5 trên 10; hoặc có thành tích nghiên cứu, học tập nổi trội ( kèm theo chứng nhận)",http://www.seed-net.org/application-forms/,October,28/8/2017,checked
My Travel Luggage Advance Scholarship Program,1398,,My Travel Luggage Advance Scholarship Program,Company-sponsor Scholarship,,"Undergraduate ,Post-graduate ",United State,"""Hospitality, Tourism and Sports""",Cash award,"Under this scholarship, applicants need to write 1000-1500 words on the provided topics, and the best one will be the awarded with 500$. By participating in this scholarship, you need to prove your strong writing ability.
Deadline: 10 Oct 2018
Award announce: 1 Jan 2019",http://www.my-travel-luggage.com/scholarship/,October,9/12/2017,
" Politecnico di Milano Merit-based Scholarship, Italy",1412,," Politecnico di Milano Merit-based Scholarship, Italy",University-sponsor Scholarship,checked,Master,Italy,A LOT OF DISCIPLINES,"100% tuition fee,Nearly full scholarship (withour air tickets or accommodation)","Có 3 cấp học bổng:
Platinum: Miễn học phí + EUR 10.000 sinh hoạt phí trong 1 năm. 
Gold: Miễn học phí + EUR 5000 sinh hoạt phí trong 1 năm
Silver: Miễn học phí
Các học bổng đều được duy trì cho năm tiếp theo nếu đáp ứng được thành tích học tập.",http://www.polinternational.polimi.it/how-to-apply/laurea-magistrale/scholarships/,"March,November",9/12/2017,
" tAntenna Systems and Applications Laboratory at EE department in Hongik University, Seoul, Korea",870,," tAntenna Systems and Applications Laboratory at EE department in Hongik University, Seoul, Korea",University-sponsor Scholarship,,"PhD ,Master ",South Korea,Engineer and Technology,100% tuition fee,,http://grad.hongik.ac.kr/subpage/foreigner.php?id=3,October,26/8/2017,checked
the Holland Scholarship programme,1065,,the Holland Scholarship programme,University-sponsor Scholarship,checked,Undergraduate,Netherland,"Business and finance,A LOT OF DISCIPLINES ",less than 50% tuition fee,"IELTS 6.0 trở lên
Chỉ trợ cấp cho năm đầu tiên",https://stenden.com/en/practical-information/scholarships/,January,5/9/2017,
UNIST Scholarship in Korea,691,,UNIST Scholarship in Korea,University-sponsor Scholarship,checked,Undergraduate,South Korea,A LOT OF DISCIPLINES,Full scholarship,,http://adm-u.intl.unist.ac.kr/,September,21/8/2017,
" University of British Columbia Scholarships for International Students in Canada, 2018",1056,," University of British Columbia Scholarships for International Students in Canada, 2018",University-sponsor Scholarship,checked,Undergraduate,Canada,A LOT OF DISCIPLINES,100% tuition fee,"To be considered for the IMES, you must
+     Be new to UBC, entering directly from secondary school or post-secondary (university or college)
+   Be an international student who will be studying at UBC on a Canadian study permit (student visa). (Changes to your citizenship status will affect your IMES eligibility.)
+  Demonstrate exceptional academic achievement and intellectual promise, as well as impressive extracurricular and community involvement
+   Apply to UBC by January 15",http://you.ubc.ca/financial-planning/scholarships-awards-international-students/,January,5/9/2017,
Vietnam Young Leader Awards,23,,Vietnam Young Leader Awards,Government Scholarship,checked,"Master ,PhD ",Vietnam,Business and finance,Full scholarship,Ưu tiên các bạn làm khối nhà nước,https://www.vyla.info/,January,18/8/2017,
“Let Wisdom Rise” Scholarship Competition,934,,“Let Wisdom Rise” Scholarship Competition,University-sponsor Scholarship,checked,Undergraduate,United State,A LOT OF DISCIPLINES,less than 50% tuition fee,"Phải nộp đơn nhập học vào trường trước khi apply học bổng.
Cần nộp học bạ, SAT/ACT đúng hạn:
Mùa thu: November 4
Mùa xuân: February 10",http://www.randolphcollege.edu/admission/scholarship-competition/,November,4/9/2017,
[Hàn Quốc] Học bổng toàn phần sau đại học tại Viện Khoa học và Công nghệ Deagu Gyeongbuk (DGIST) 2018,1251,,[Hàn Quốc] Học bổng toàn phần sau đại học tại Viện Khoa học và Công nghệ Deagu Gyeongbuk (DGIST) 2018,University-sponsor Scholarship,,"Post-graduate ,Master ",South Korea,Computer science and IT,Full scholarship,,http://admission.dgist.ac.kr/site/dgist_admission/menu/478.do,December,21/9/2017,
[Slovak Republic] Học Bổng Chính Phủ Cộng Hòa Slovakia 2017-2018,315,,[Slovak Republic] Học Bổng Chính Phủ Cộng Hòa Slovakia 2017-2018,Government Scholarship,checked,"PhD ,Post-graduate ",Slovakia,A LOT OF DISCIPLINES,less than 50% tuition fee,,https://www.scholarships.sk/en/main/programme-terms-and-conditions/foreign-applicants,"April,October ",18/8/2017,
[UK] Học Bổng Thạc Sĩ IMSISS and ERASMUS Mundus 2018,1364,,[UK] Học Bổng Thạc Sĩ IMSISS and ERASMUS Mundus 2018,Government Scholarship,checked,Master,United Kingdom,Computer science and IT,Full scholarship,"You should have a 2.1 Honours degree or equivalent qualification in a relevant subject, such as, but not limited to politics, international relations, history, area and cultural studies, law, sociology, criminology, human geography, computing science, language sciences, global studies, psychology, media studies and journalism, modern languages or business. Other disciplines not listed here will be considered on an individual basis. ","https://www.gla.ac.uk/postgraduate/erasmusmundus/imsiss/#/aboutimsiss,keyfacts,whystudythisprogramme?",January,12/10/2017,
8th Model Asia-Europe Meeting,760,,8th Model Asia-Europe Meeting,Conference Scholarship,checked,"Undergraduate ,Post-graduate ,Master ,PhD ",Myanmar,A LOT OF DISCIPLINES,Full scholarship,,http://asef.org/projects/themes/education/4104-modelasem8,September,23/8/2017,
30% Club / ESMT MBA Women's Scholarship,1196,,30% Club / ESMT MBA Women's Scholarship,University-sponsor Scholarship,checked,No specified,Germany,Business and finance,less than 50% tuition fee,"- Học bổng MBA dành cho nữ. 
- Phải chứng minh được là đã có sự xuất sắc trong leadership trong công việc.",https://www.esmt.org/degree-programs/full-time-mba/fees-and-financing/mba-scholarships,Change every year,17/9/2017,
100% MBA Scholarship at École des Ponts Business School,738,,100% MBA Scholarship at École des Ponts Business School,University-sponsor Scholarship,,Master,France,Business and finance,"100% tuition fee,50% tuition fee ,less than 50% tuition fee ","These merit-based scholarships will be awarded to applicants on a first-come, first-served basis.
(Vì hôm nay em cũng mới kiếm học bổng này ạ nên em cũng chỉ biết trong nội hạt website đưa tin thôi ạ )",https://pontsbschool.com/programs/full-time-mba/new-mba-scholarships/,September,22/8/2017,
200 suất học bổng du học miễn phí tại Đài Loan,1243,,200 suất học bổng du học miễn phí tại Đài Loan,University-sponsor Scholarship,checked,Undergraduate,Taiwan,"Engineer and Technology ,""Arts, Design and Photography"",Journalism and Media ,Computer science and IT ","100% tuition fee,Full scholarship","18-25 yrs-old
GPA >= 6.5
Graduated High school",http://vietnamtimes.info/2017/09/20/200-suat-hoc-bong-du-hoc-mien-phi-dai-loan/,"Febuary,September",20/9/2017,
600 Tennessee Tech University Scholarships in USA,1349,,600 Tennessee Tech University Scholarships in USA,University-sponsor Scholarship,checked,Undergraduate,United State,A LOT OF DISCIPLINES,"Full scholarship,more than 50% tuition fee,100% tuition fee,Nearly full scholarship (withour air tickets or accommodation),less than 50% tuition fee ,50% tuition fee ","Học bổng trị giá nhất lên tới 100% học phí, còn có cả phí sinh hoạt và các khoản hỗ trợ khác khi sống tại Mỹ ạ .",https://www.tntech.edu/em/scholarships/,December,5/10/2017,
A. Wilhelmsen Foundation scholarship programme,374,,A. Wilhelmsen Foundation scholarship programme,Company-sponsor Scholarship,,Master,Norway,Business and finance,Cash award,Học bổng này có giá trị NOK 75 000 chỉ trao cho sinh viên đang theo học tại trường BI Norwegian Business school ạ.,https://www.bi.edu/study-at-bi/scholarships/a.-wilhelmsen-foundation-scholarship-programme/,March,18/8/2017,
A.S. Hornby Trust Scholarship Programme,1214,,A.S. Hornby Trust Scholarship Programme,University-sponsor Scholarship,checked,Post-graduate,United Kingdom,Social sciences and Humanities,Cash award,Theo như em đọc được thì nếu muốn apply học bổng này thì phải liên hệ với trang Bristish Council chứ không phải web chính thức,http://www.hornby-trust.org.uk/home/4557353331,December,19/9/2017,
"AAI One World Scholarship Programme for Developing Countries in Austria, 2017",888,,"AAI One World Scholarship Programme for Developing Countries in Austria, 2017",No specified,,"Master ,PhD ",Austria,A LOT OF DISCIPLINES,50% tuition fee,,http://www.aai-salzburg.at/en_students_scholarship.htm,July,30/8/2017,checked
Aalto University Scholarship programme,258,,Aalto University Scholarship programme,University-sponsor Scholarship,checked,"Master ,Undergraduate ",Finland,A LOT OF DISCIPLINES,100% tuition fee,,http://www.aalto.fi/en/studies/fees_and_scholarships/,January,18/8/2017,
AAUW International Fellowships in USA for Women,369,,AAUW International Fellowships in USA for Women,Fellowship Scholarship,checked,"Post-graduate ,Master ,PhD ",United State,A LOT OF DISCIPLINES,Cash award,"*Intend to return to her home country to pursue a professional career.

*Institutional TOEFL scores and other English proficiency test scores (such as IELTS) will not be accepted. Minimum score acceptable: 550 for Paper-Based Test (TOEFL PBT); 79 for Internet-Based Test (TOEFL iBT); 60 for Revised TOEFL Paper-Delivered Test.

*The $30 filing fee is required to cover the cost of administering the application process. Payment will be accepted through Braintree. AAUW does not provide application fee refunds for ineligible, incomplete, or unsuccessful applications. 

",http://www.aauw.org/what-we-do/educational-funding-and-awards/international-fellowships/if-application/,December,18/8/2017,
Access Opportunity Scholarship at University College London,1144,,Access Opportunity Scholarship at University College London,University-sponsor Scholarship,checked,Undergraduate,United Kingdom,A LOT OF DISCIPLINES,Full scholarship,"The scholarship will consist of full tuition fees and a living allowance of £10,750 per year for the normal duration of your programme at UCL.   Annual renewal of the scholarship is subject to satisfactory academic progress.",http://www.scholars4dev.com/20796/access-opportunity-scholarship-at-university-college-london/,July,12/9/2017,
ADB Scholarships at University of Auckland,996,,ADB Scholarships at University of Auckland,University-sponsor Scholarship,checked,Master,New Zealand,A LOT OF DISCIPLINES,Full scholarship,Học bổng yêu cầu người tham gia phải có ít nhất 2 năm kinh nghiệm làm việc sau đại học và phải dưới 35 tuổi (một số trường hợp đặc biệt thì dưới 45 tuổi). Đặc biệt người tham gia phải đồng ý quay trở về nước sau khi hoàn tất chương trình học.,https://www.auckland.ac.nz/en/study/international-students/scholarships-loans-and-funding/development-scholarships/asian-development-bank-japan-scholarship-program.html,July,9/9/2017,
ADB- JSP (Auckland University - New Zealand),24,,ADB- JSP (Auckland University - New Zealand),Company-sponsor Scholarship,checked,Master,New Zealand,A LOT OF DISCIPLINES,Full scholarship,Bất kì chương trình học nào Auckland Uni offer đều được.,https://www.auckland.ac.nz/en/study/international-students/scholarships-loans-and-funding/development-scholarships/asian-development-bank-japan-scholarship-program.html,July,17/8/2017,
Adelaide International Undergraduate Scholarships (AIUS),20,,Adelaide International Undergraduate Scholarships (AIUS),University-sponsor Scholarship,checked,Undergraduate,Australia,A LOT OF DISCIPLINES,less than 50% tuition fee,"25% học phí trong 4 năm

Available for study in any discipline except Bachelor of Medicine, Bachelor of Surgery (MBBS), Bachelor of Dental Surgery (BDS), Bachelor of Oral Health and Bachelor of Science (Veterinary Bioscience)",https://international.adelaide.edu.au/choosing/scholarships/aius/,"June ,January ",15/8/2017,checked
Adelaide Scholarships International,356,,Adelaide Scholarships International,University-sponsor Scholarship,checked,"Master ,PhD ",Australia,A LOT OF DISCIPLINES,Full scholarship,"An annual living allowance ($26,288 in 2016) for two years for a Masters degree by Research and three years for a Doctoral research degree (an extension is possible for doctoral programs only), for Student Visa (Subclass 500) visa holders the award provides compulsory standard Overseas Student Health Cover (OSHC) Worldcare policy for the student and their spouse and dependents (if any) for the standard duration of the student visa.  It does not cover the additional 6 month extended student visa period post thesis submission. If the award holder does not hold a subclass 500 visa then he/she is responsible for the cost of health insurance",http://www.adelaide.edu.au/graduatecentre/scholarships/research-international/opportunities/adelaide-scholarship-international/,August,18/8/2017,
Admission scholarship scheme for overseas students of Hongkong Baptist University,25,,Admission scholarship scheme for overseas students of Hongkong Baptist University,University-sponsor Scholarship,checked,Undergraduate,Hong Kong,A LOT OF DISCIPLINES,Full scholarship,Trường tự đề cử ứng viên,http://sa.hkbu.edu.hk/sfa/scholarships/admission-scholarships/admission-scholarships-for-outstanding-mainland-international-and-non-jupas-local-applicants,May,17/8/2017,
AEON Scholarship,1211,,AEON Scholarship,University-sponsor Scholarship,checked,Post-graduate,Japan,A LOT OF DISCIPLINES,"100% tuition fee,Cash award ","Học bổng dành cho sinh viên châu viên châu Á dưới 35 tuổi khi đăng ký vào một ngành học của trường International University of Japan, có thành tích học tập tốt và trình độ tiếng Nhật tương đương trình N3. 
Học bổng bao gồm: 
* 250,000 yen trên tổng số 300,000 yen phí nộp hồ sơ
* Toàn bộ học phí
* trợ cấp hàng tháng 100,000 yen",http://www.iuj.ac.jp/admission/pdf/2018/Sch_Instructions_M_E.pdf,Febuary,19/9/2017,
AFoCo Landmark Graduate Scholarship,1071,,AFoCo Landmark Graduate Scholarship,Government Scholarship,checked,Post-graduate,South Korea,Environmental studies and earth sciences,Full scholarship,,http://www.afocosec.org/afoco/pc/en/news/notice/view.php?id=99,March,5/9/2017,
Agnes Paykel PhD Scholarships,758,,Agnes Paykel PhD Scholarships,University-sponsor Scholarship,checked,PhD,New Zealand,A LOT OF DISCIPLINES,Cash award,"- Usually open around 6 weeks before the closing date. 
- Up to $27,000pa plus domestic PhD fees and international student health insurance (if applicable)
- Tenure of reward: up to 3 years (for applicants who hold a first-class academic record)",https://www.auckland.ac.nz/en/for/current-students/cs-scholarships-and-awards/cs-search-for-scholarships-and-awards/agnes-paykel-phd-scholarships-735-lig.html,December,23/8/2017,
Agriculture and environment in a changing climate- the Israeli Perspective,1242,,Agriculture and environment in a changing climate- the Israeli Perspective,Government Scholarship,,Post-graduate,Israel,Natural Sciences and Mathematics,100% tuition fee,Khóa học ngắn hạn,http://bit.ly/nongnghiepvamoitruong-israel2017,October,20/9/2017,
Aichi Scholarship Program,694,,Aichi Scholarship Program,Government Scholarship,checked,"PhD ,Master ",Japan,"Business and finance,Engineer and Technology ",Nearly full scholarship (withour air tickets or accommodation),"- Liên hệ với Varonet nếu có nguyện vọng xin được hội Varonet (Hội cựu du học sinh Việt Nam tỉnh Aichi) tiến cử lên tỉnh Aichi (Varonet tiến cử sẽ làm TĂNG thêm cơ hội nhận được học bổng, các bạn cũng có thể không cần thông qua sự tiến cử của hội).
- Các bạn PHẢI tìm được giáo sư và trường đại học chấp nhận trước khi nộp hồ sơ cho Varonet",http://www.pref.aichi.jp/kokusai/ryugakusei-portal/e/ukeire/index.html,June,21/8/2017,checked
AIT VIETNAM’S 25TH ANNIVERSARY SCHOLARSHIP PROGRAM FOR 2015 - 2018,1093,,AIT VIETNAM’S 25TH ANNIVERSARY SCHOLARSHIP PROGRAM FOR 2015 - 2018,University-sponsor Scholarship,checked,"Post-graduate ,Master ,PhD ",Thailand,A LOT OF DISCIPLINES,Nearly full scholarship (withour air tickets or accommodation),,http://www.ait.asia/admissions/Current_Scholarships/ait-vietnam2019s-25th-anniversary-scholarship-program-for-2015-2018/#.Wa-2_NDTTDc,November,6/9/2017,
