Name,Auto number,Program check,Program name,Type of Opportunity,Annual scholarship?,Study level,Host Country,Discipline,Value,Note,Link,Deadline?,Date updated,Checked?
Jardine Foundation scholarship,108,,Jardine Foundation scholarship,Company-sponsor Scholarship,checked,"Undergraduate ,Post-graduate ",United Kingdom,A LOT OF DISCIPLINES,Full scholarship,"1. Học bổng này sẽ chi trả cho các chương trình học tại một số college thuộc đại học Oxford hoặc đại học Cambridge. 
2. Trong vòng phỏng vấn đầu tiên, ứng viên cần tự chi trả các chi phí đi lại đến 1 trong các địa điểm phỏng vấn bao gồm Hong Kong, Jakarta, Kuala Lumpur, London and Singapore.",http://www.jardines.com/community/jardine-foundation.html,October,17/8/2017,
Jasso scholarship,109,,Jasso scholarship,Government Scholarship,checked,Undergraduate,Japan,A LOT OF DISCIPLINES,Nearly full scholarship (withour air tickets or accommodation),"Jasso có bao gồm cả sinh hoạt phí , cần phải giữ thành tích học tốt để apply và duy trì mức học bổng",http://www.jasso.go.jp/en/,Change every year,17/8/2017,
Jeffrey Cheah Scholarship From Sunway University in Malaysia,291,,Jeffrey Cheah Scholarship From Sunway University in Malaysia,University-sponsor Scholarship,checked,Undergraduate,Malaysia,A LOT OF DISCIPLINES,"more than 50% tuition fee,less than 50% tuition fee ,50% tuition fee ,100% tuition fee","Hiện em đang học tại trường Sunway. Đa phần là học bổng bán phần từ 25% up to 100%, tùy thuộc vào hồ sơ đầu vào lúc mình apply và điểm số cần thiết để duy trì học bổng qua mỗi kì học.",https://university.sunway.edu.my/scholarships,Change every year,18/8/2017,
JFUNU Scholarships for PhD in Sustainability Science,110,,JFUNU Scholarships for PhD in Sustainability Science,University-sponsor Scholarship,checked,PhD,Japan,Environmental studies and earth sciences,100% tuition fee,,https://ias.unu.edu/en/admissions/degrees/phd-in-sustainability-science-2017.html#scholarships,April,18/8/2017,
JGC-S ( Nikki-Saneyoshi) scholarship Foundation (type II),1193,,JGC-S ( Nikki-Saneyoshi) scholarship Foundation (type II),Conference Scholarship,checked,"Master ,PhD ,Post-graduate ",Japan,Engineer and Technology,Cash award,,http://www.jgcs.or.jp,October,17/9/2017,
JGSEE Scholarship,391,,JGSEE Scholarship,University-sponsor Scholarship,checked,"Master ,PhD ,Undergraduate ",Thailand,A LOT OF DISCIPLINES,"Full scholarship,100% tuition fee",Hầu hết các học bổng mà bên phía trường trao đều thiên về nghiên cứu và làm việc trong phòng lab. Điều kiện thứ yếu là GPA 2.75. Giá trị học bổng đối với hệ MSc: 135000 baht và hệ Ph.D : 290000 baht.,http://www.jgsee.kmutt.ac.th/jgsee1/Admissions/Scholarships.php,July,18/8/2017,
JICA Innovative Asia,1397,,JICA Innovative Asia,Government Scholarship,checked,"Master ,PhD ",Japan,A LOT OF DISCIPLINES,Full scholarship,"Học bổng mở tháng 4/2018.
",https://www.jica.go.jp/english/countries/asia/innovative_asia.html,May,9/12/2017,
JICA Scholarships for Asian Students at Japanese Universities,1001,,JICA Scholarships for Asian Students at Japanese Universities,No specified,checked,"Master ,PhD ",Japan,"Engineer and Technology ,Computer science and IT ",Full scholarship,Adequate English skills both in written and oral communication to complete the master’s course or doctor’s course.,https://www.jica.go.jp/english/countries/asia/innovative_asia.html,Change every year,9/9/2017,
Jim Ellert MBA Scholarship at IMD,585,,Jim Ellert MBA Scholarship at IMD,University-sponsor Scholarship,checked,Master,Switzerland,Business and finance,Cash award,,http://www.imd.org/mba/admissions/one-year-mba-program-financial-aid/,September,19/8/2017,
Joint Japan/World Bank Graduate Scholarship Program,576,,Joint Japan/World Bank Graduate Scholarship Program,Company-sponsor Scholarship,checked,Master,Japan,A LOT OF DISCIPLINES,100% tuition fee,"Đối với học bổng này phải có 3 năm kinh nghiệm sau khi tốt nghiệp đại học, apply online, và ít nhất đã tốp nghiệp đại học 3 năm tính đến thời điểm nộp học bổng.",http://www.worldbank.org/en/programs/scholarships#3,Febuary,19/8/2017,
Jungseok International Scholarship,1092,,Jungseok International Scholarship,University-sponsor Scholarship,checked,"Master ,PhD ",South Korea,A LOT OF DISCIPLINES,more than 50% tuition fee,100% (chỉ cho PhD),http://gradeng.inha.ac.kr/entrance/ent_030301.aspx,"April,October ",6/9/2017,
Justus & Louise van Effen,12,,Justus & Louise van Effen,University-sponsor Scholarship,checked,Master,Netherland,A LOT OF DISCIPLINES,Nearly full scholarship (withour air tickets or accommodation),,https://www.tudelft.nl/en/education/practical-matters/scholarships/justus-louise-van-effen-excellence-scholarships/,March,15/8/2017,
JYU (University of Jyväskylä) International Master’s Degree Students Scholarship Programme,1209,,JYU (University of Jyväskylä) International Master’s Degree Students Scholarship Programme,University-sponsor Scholarship,checked,Master,Finland,A LOT OF DISCIPLINES,100% tuition fee,"50% tổng số ứng viên sẽ nhận được học bổng này. Học bổng của năm học thứ 2 sẽ phụ thuộc vào kết quả học tập của năm nhất.

",https://opiskelu.jyu.fi/en/apply/masters-programmes/scholarships,January,19/9/2017,
JYU International Master’s Degree Students Scholarship,509,,JYU International Master’s Degree Students Scholarship,University-sponsor Scholarship,checked,Master,Finland,Social sciences and Humanities,100% tuition fee,Cần giữ thành tích học tập tốt để duy trì học bổng cho năm sau.,https://opiskelu.jyu.fi/en/apply/masters-programmes/scholarships,January,19/8/2017,
KAAD (Katholischer Akademischer Auslaender-Dienst),112,,KAAD (Katholischer Akademischer Auslaender-Dienst),Fellowship Scholarship,checked,"Master ,Post-graduate ,PhD ",Germany,A LOT OF DISCIPLINES,Full scholarship,"- Học bổng ưu tiên cho người Công giáo (những bạn thuộc tôn giáo khác có thể apply nếu có các điều kiện đặc biệt, ví dụ như được một linh mục giới thiệu, hoặc cam kết có những kế hoạch cho việc phát triển đối thoại đa tôn giáo,...)
- Sinh viên bắt buộc phải trở về nước sau khi học xong. Nếu không thì học bổng sẽ trở thành nợ và phải trả lại cho tổ chức.
- Học bổng bao gồm: vé máy bay, chi phí hằng tháng cover ăn ở tại Đức, khóa học tiếng Đức 6 tháng ở Đức (optional). Ở Đức đa phần các trường không thu học phí rồi nên học bổng này có thể coi là ""toàn phần"".

Cảm ơn chị ạ ^_^",http://www.kaad.de/en/stipendien/stipendienprogramm-s1/; http://giaoducconggiaohdgm.org/bai-viet/thong-bao-gioi-thieu-hoc-bong-kaad,"July,December",17/8/2017,
KAIST Global IT Technology Program(ITTP),511,,KAIST Global IT Technology Program(ITTP),Government Scholarship,checked,"Master ,PhD ",South Korea,Computer science and IT,Full scholarship,"Scholarship includes:
Tuition fee 
One-way airfare(Economy Class, Max KRW 1,500,000)
Living cost(KRW 1,500,000 per month)
National medical insurance
Relocation expenses",http://ittp.kaist.ac.kr/_prog/_board/?code=board_04&mode=V&no=1640&upr_ntt_no=1640&site_dvs_cd=kr&menu_dvs_cd=0601,September,19/8/2017,
Kanagawa university scholarship for international students (外国人留学生授業料減免制度),1219,,Kanagawa university scholarship for international students (外国人留学生授業料減免制度),University-sponsor Scholarship,checked,"Undergraduate ,Master ,PhD ",Japan,A LOT OF DISCIPLINES,less than 50% tuition fee,"Học bổng này dành cho du học sinh trường đại học Kanagawa, đối với học sinh bình thường thì giảm học phí 30%, còn đối với học sinh có thành tích tốt thì là 50%. ",http://www.kanagawa-u.ac.jp/campuslife/scholarship/international/,June,19/9/2017,
Kaohsiung City International Student Scholarship,955,,Kaohsiung City International Student Scholarship,Government Scholarship,checked,No specified,Taiwan,A LOT OF DISCIPLINES,Cash award,"- Phù hợp với điều kiện là học sinh quốc tế đang học tập tại thành phố Cao Hùng, Đài Loan. 
- Bắt buộc phải apply qua trường và được nhận được university's recommendation
- GPA đạt được 80% trong học kỳ gần nhất với thời điểm apply. 
- Có đóng góp tích cực trong các hoạt động ngoại khóa, trao đổi văn hóa. ","http://oia.nsysu.edu.tw/files/14-1328-168169,r2688-1.php?Lang=en",May,5/9/2017,
Kasetsart University Postgraduate Scholarship Program for ASEAN Students 2017  Thailand,677,,Kasetsart University Postgraduate Scholarship Program for ASEAN Students 2017  Thailand,University-sponsor Scholarship,,Master,Thailand,A LOT OF DISCIPLINES,100% tuition fee,,http://www.grad.ku.ac.th/en/download/kasetsart-university-scholarship-asean_eng-2017/?wpdmdl=24957&masterkey=592e378d99103,July,20/8/2017,
KAUST Fellowship,988,,KAUST Fellowship,University-sponsor Scholarship,,Post-graduate,No specified,A LOT OF DISCIPLINES,"Full scholarship,100% tuition fee","All admitted students receive the benefits of the KAUST Fellowship which supports students for the duration of their graduate studies. The benefits of the KAUST Fellowship include:
​Full tuition support
Monthly living allowance (ranging between $20,000-30,000 annual, depending on qualifications and progression through degree programs)
Housing*
Medical and dental coverage*
Relocation support
* Charges may apply to dependent housing and medical and dental coverage.",https://www.kaust.edu.sa/en/study/applying-to-kaust,Change every year,7/9/2017,
"KCL Fully Funded Undergraduate Summer School Scholarships for International Students in UK, 2018",1376,,"KCL Fully Funded Undergraduate Summer School Scholarships for International Students in UK, 2018",University-sponsor Scholarship,,Undergraduate,United Kingdom,A LOT OF DISCIPLINES,100% tuition fee,"These scholarships will cover the tuition fee of £1,500. ",https://www.kcl.ac.uk/study/summer/index.aspx,April,28/10/2017,
Keio University “Design the Future” Award for International Students,115,,Keio University “Design the Future” Award for International Students,University-sponsor Scholarship,checked,"Post-graduate ,Master ,PhD ",Japan,A LOT OF DISCIPLINES,Full scholarship,"- Học bổng cho miễn phí toàn bộ học phí ở Keio cho bậc Master và PhD (nhiều ngành) kèm theo mỗi tháng một khoảng stipend là 200.000 yen. Ngoài ra thì recipient cũng được thêm 150.000 yen trả một lần (one-time preparation grant) để chi trả những chi phí khi mới sang như tiền vé máy bay...
- Tuy nhiên học bổng này không dành cho ứng viên đã học ở Nhật hoặc có bằng tốt nghiệp ĐH ở Nhật. Vậy nên miễn là chưa từng học ở Nhật thì hoàn toàn có thể apply cho học bổng này.",http://www.ic.keio.ac.jp/en/life/scholarship/dfaward.html,"October ,September",17/8/2017,
Kemitraan Negara Berkembang (KNB) Scholarship,116,,Kemitraan Negara Berkembang (KNB) Scholarship,Government Scholarship,checked,"Master ,Undergraduate ",Indonesia,A LOT OF DISCIPLINES,Full scholarship,,http://www.knb.ristekdikti.go.id/,April,18/8/2017,checked
Ken Lim Memorial Scholarships,872,,Ken Lim Memorial Scholarships,University-sponsor Scholarship,checked,Undergraduate,New Zealand,"Social sciences and Humanities ,Environmental studies and earth sciences",less than 50% tuition fee,"- Mức học bổng (NZD)/năm: 5.000
- Thời gian cấp học bổng: 2 năm
- Số lượng: 2 suất
- Hỗ trợ vé máy bay và visa",https://www.auckland.ac.nz/en/for/current-students/cs-scholarships-and-awards/cs-search-for-scholarships-and-awards/ken-lim-memorial-scholarship-822-eng.html,Change every year,27/8/2017,checked
Kent International Student Scholarship,1201,Tiered Scholarship - University of Kent,Kent International Student Scholarship,University-sponsor Scholarship,checked,High school,Australia,A LOT OF DISCIPLINES,less than 50% tuition fee,,http://kent.edu.au/kent3/scholarships/,Change every year,19/9/2017,
Kewalram Chanrai Scholarship,629,,Kewalram Chanrai Scholarship,University-sponsor Scholarship,checked,Undergraduate,Singapore,A LOT OF DISCIPLINES,100% tuition fee,Mức học bổng sẽ thay đổi dựa vào tỉ lệ tuition fee của Singaporeans / Permanent Residents / International Students,http://admissions.yale-nus.edu.sg/afford/,March,20/8/2017,
KFAS International Scholar Exchange Fellowship (ISEF),1180,,KFAS International Scholar Exchange Fellowship (ISEF),University-sponsor Scholarship,checked,PhD,South Korea,"Computer science and IT ,Social sciences and Humanities ,Environmental studies and earth sciences",Full scholarship,,http://www.kfas.or.kr/Science/ISEF/ISEF0201.aspx,"Febuary,November",16/9/2017,
KILLAM POSTDOCTORAL RESEARCH FELLOWSHIP,1247,,KILLAM POSTDOCTORAL RESEARCH FELLOWSHIP,Fellowship Scholarship,checked,PhD,Canada,A LOT OF DISCIPLINES,Cash award,"Giá trị hàng năm: Học phí hàng năm 50.000 đô la cho tối đa là hai năm, cộng với trợ cấp nghiên cứu du lịch 4.000 đô la trong hai năm",https://www.postdocs.ubc.ca/award/killam-postdoctoral-research-fellowship#,November,21/9/2017,
King Abdullah University of Science and Technology (KAUST) and the Islamic Development Bank (IDB),999,,King Abdullah University of Science and Technology (KAUST) and the Islamic Development Bank (IDB),University-sponsor Scholarship,,PhD,United Arab Emirates,Engineer and Technology,Full scholarship,"Chỉ có 5 suất học bổng mỗi năm, và giá trị học bổng có thể là toàn phần (căn cứ vào thành tích học tập của mỗi ứng cử viên)",https://www.kaust.edu.sa/en/study/idb-kaust-scholarship,Change every year,9/9/2017,
Knight Visiting Nieman Fellowships,876,,Knight Visiting Nieman Fellowships,Fellowship Scholarship,checked,No specified,United State,Journalism and Media,Full scholarship,"If not supported by employer, a weekly stipend of $1,225 will be provided. 
Furnished one bedroom also provided. 
Need to have proven records or potential works to advance in journalism.",http://nieman.harvard.edu/fellowships/nieman-visiting-fellowships/,September,28/8/2017,checked
Knight-Hennessy Scholars - Stanford University,300,,Knight-Hennessy Scholars - Stanford University,University-sponsor Scholarship,checked,"Post-graduate ,Master ",United State,A LOT OF DISCIPLINES,100% tuition fee,"_  additional financial support available
_ học bổng nào cũng có cái giá của nó nên yêu cầu của học bổng này rất cao
_ 2 lần apply, lần 2 deadline mỗi program khác nhau",https://knight-hennessy.stanford.edu/,November,18/8/2017,
Kochi University of Technology Special Scholarship Program (SSP) in Japan,775,,Kochi University of Technology Special Scholarship Program (SSP) in Japan,University-sponsor Scholarship,checked,Post-graduate,Japan,Engineer and Technology,Cash award,,http://www.kochi-tech.ac.jp/kut_E/graduate/admission1.html,September,24/8/2017,
Konkuk University Scholarship,866,,Konkuk University Scholarship,University-sponsor Scholarship,checked,Undergraduate,South Korea,A LOT OF DISCIPLINES,"less than 50% tuition fee ,50% tuition fee ",Scholarships are rewarded based on TOPIK level (Korean proficiency),http://www.konkuk.ac.kr/eng/doc/2017/Fall_2017_Admissions_Guidelines_(English).pdf,May,26/8/2017,checked
Kookmin University Graduate Scholarship,879,,Kookmin University Graduate Scholarship,University-sponsor Scholarship,checked,"Undergraduate ,Master ",South Korea,A LOT OF DISCIPLINES,"50% tuition fee ,less than 50% tuition fee ,100% tuition fee","TOPIK 4  (Korean Proficiency Test)
GPA 3.75",http://iaten.kookmin.ac.kr/site/student/scholarship.htm,Change every year,29/8/2017,checked
Korea University of Science & Technology,1068,,Korea University of Science & Technology,University-sponsor Scholarship,checked,"Post-graduate ,Master ,PhD ",South Korea,A LOT OF DISCIPLINES,Nearly full scholarship (withour air tickets or accommodation),"Học bổng chỉ yêu cầu chứng chỉ tiếng Anh (TOEIC >730, IELTS>6.0...), tuy nhiên GPA càng cao thì khả năng được nhận càng lớn",https://www.ust.ac.kr/eng.do,"September,March",5/9/2017,
Korean Government Scholarship Program,515,,Korean Government Scholarship Program,Government Scholarship,checked,"Undergraduate ,Post-graduate ,Master ,PhD ",South Korea,A LOT OF DISCIPLINES,Full scholarship,"Sẽ được thêm 100,000 KRW hàng tháng nếu có kết quả tiếng Hàn tốt (TOPIK Level 5 or 6)",http://www.niied.go.kr/eng/contents.do?contentsNo=78&menuNo=349,September,19/8/2017,
Kristianstad University Scholarship,971,,Kristianstad University Scholarship,Government Scholarship,checked,Post-graduate,Sweden,A LOT OF DISCIPLINES,100% tuition fee,,https://www.hkr.se/en/study-at-hkr/non-exchange-student/scholarship/,Febuary,5/9/2017,
KSUM International Fellowship,508,,KSUM International Fellowship,Fellowship Scholarship,checked,No specified,South Korea,Medicine and Health,"Full scholarship,Cash award ",Học bổng từ 2000-4000$ tùy thuộc vào thời gian đào tạo,http://ksum.or.kr/fellowship/index.php,November,19/8/2017,
KU GSIS International Students Scholarship A/B,939,,KU GSIS International Students Scholarship A/B,University-sponsor Scholarship,checked,PhD,South Korea,A LOT OF DISCIPLINES,"less than 50% tuition fee ,more than 50% tuition fee,100% tuition fee","Qualifications:
1. Minimum Condition: International Students with GPA 3.75 and above
2. can not take semester off
Selection Process:
1. Entrance score is applied for 1st semester
2. As for the consecutive semester, scholarship type (A/B) will be decided based on the previous semester GPA’s ranking among KUGSIS int’l students.",https://gsis.korea.ac.kr/admissions/tuition-fees-and-scholarships,April,4/9/2017,
Kulturstudier Development Studies 1,1382,,Kulturstudier Development Studies 1,University-sponsor Scholarship,checked,Undergraduate,Norway,Social sciences and Humanities,Nearly full scholarship (withour air tickets or accommodation),"This is the unique international course taking place in Vietnam. 
The Norwegian organization Kulturstudier (Culture Studies) is offering scholarships to Vietnam nationals wishing to attend the 10-week’s university undergraduate social science course Studying Development, in Hoi An, Vietnam. 
The programme has been offered twice every year since 2004. Each semester about 40 students take part in the programme. Most are from Scandinavia. Four are Vietnamese. Applicants must have an interest in social science and international issues. 
The Scholarship includes:
 Tuition fees and course literature
 Breakfast and lunch Monday to Friday during the 10 weeks in Hoi An.
 Accommodation (in double or multiple room shared with other students)
 Monthly allowance for basic expenses during 10 weeks in Hoi An. ",https://www.kulturstudier.no/m/files/Stipendutlysninger/Announcement_Vietnam_Overall_2016-2017.pdf,"June,December",12/11/2017,
KUT PhD Engineering Scholarships for International Students,1179,,KUT PhD Engineering Scholarships for International Students,University-sponsor Scholarship,,PhD,Japan,Engineer and Technology,Full scholarship,,https://www.kochi-tech.ac.jp/english/admission/ssp/guideline.html,"April,October ",16/9/2017,
Kutztown Pennsylvania University Scholarship,615,,Kutztown Pennsylvania University Scholarship,University-sponsor Scholarship,,Undergraduate,United State,A LOT OF DISCIPLINES,100% tuition fee,"Em xem facebook và youtube của cặp đôi Chị Chang makeup và anh Trọng Đức (@ttduc95) thì đều đạt học bổng 100% trường này.
Các anh chị ý có điểm toelf và SAT1 SAT2. Còn bao nhiêu em không nhớ rõ. Chị Chang là con của thầy Nghiêm dạy tiếng anh, từng nhảy trong St.319",https://www.kutztown.edu/scholarships,October,20/8/2017,
Kyoto University Amgen Scholars Program,117,,Kyoto University Amgen Scholars Program,University-sponsor Scholarship,checked,Undergraduate,Japan,Engineer and Technology,Full scholarship,"Amgen Scholars Japan Program applicants must be undergraduate students who are:
- Enrolled in colleges or universities worldwide that award a bachelor’s degree (or its equivalent); and
- At the minimum, have completed their first year of undergraduate study at the time the summer program begins, and
- Are not graduating before the summer program begins, and after the summer program ends will resume undergraduate studies for at least 1 semester or 1 quarter
Japan Program applicants must also have:
- A strong record of academic performance; and,
- A good working knowledge of English, demonstrated by a minimum TOEFL (iBT) score of 72, IELTS overall band score of 5.5, Cambridge English FCE, TOEIC score of 1095, TOEIC L&R score of 785, or TOEIC S&W score of 310, if not a native English speaker or English is not your first language, and
- An interest in pursuing a Ph.D.",http://amgenscholars.com/japan-program/university/kyoto-university,Febuary,17/8/2017,
La Trobe College Excellence Scholarships,118,,La Trobe College Excellence Scholarships,University-sponsor Scholarship,checked,"Post-graduate ,Undergraduate ",Australia,A LOT OF DISCIPLINES,less than 50% tuition fee,"To be eligible to apply for this scholarship, you must:

- be applying to study a Higher Degree program at any La Trobe campus.
- meet course prerequisites and have an International Baccalaureate Diploma score of at least 26 or higher (Australian Equivalency), for undergraduate studies.
- meet course prerequisites and have a weighted average mark (WAM) of at least 65 per cent or higher (Australian Equivalency), for postgraduate coursework studies.",http://www.latrobe.edu.au/international/fees-and-scholarships/scholarships,Change every year,17/8/2017,
La Trobe University Full Fee Research Scholarships,1165,,La Trobe University Full Fee Research Scholarships,University-sponsor Scholarship,checked,Master,Australia,A LOT OF DISCIPLINES,100% tuition fee,"The scholarship will cover tuition fees for a period of two years for a Master's by research degree, and four years for a doctoral degree.
LTUFFRS are awarded on the basis of academic merit and research capacity to suitably qualified overseas graduates eligible to commence a higher degree (doctoral or Master's) by research",http://www.latrobe.edu.au/research/future/costs-scholarships/fee-remission,October,15/9/2017,
Lancaster University Faculty Postgraduate Scholarships,688,,Lancaster University Faculty Postgraduate Scholarships,University-sponsor Scholarship,checked,"Master ,PhD ",United Kingdom,Social sciences and Humanities,100% tuition fee,,http://www.lancaster.ac.uk/arts-and-social-sciences/study/postgraduate/funding/faculty-postgraduate-scholarships/,March,21/8/2017,
LANEF PhD program (Laboratoire d'Alliances Nanosciences-Energies du futur),1279,,LANEF PhD program (Laboratoire d'Alliances Nanosciences-Energies du futur),University-sponsor Scholarship,checked,PhD,France,Engineer and Technology,Full scholarship,Lương net là 1450 €/tháng. Nếu tham gia giảng dạy có thể đạt 1690 €/tháng,http://www.grenoble-lanef.fr/spip.php?article66,September,24/9/2017,
Lappeenranta University of Technology Scholarship Programme,1033,,Lappeenranta University of Technology Scholarship Programme,University-sponsor Scholarship,checked,Post-graduate,Finland,A LOT OF DISCIPLINES,"Full scholarship,50% tuition fee ,100% tuition fee",,https://www.lut.fi/web/en/admissions/apply-to-lut/masters-studies/strategic-finance-and-business-analytics/tuition-fee-and-scholarships,January,20/9/2017,
Lappeenranta University of Technology Scholarship Programme,909,,Lappeenranta University of Technology Scholarship Programme,University-sponsor Scholarship,checked,"Post-graduate ,Master ",Finland,"Business and finance,Computer science and IT ,Environmental studies and earth sciences,Engineer and Technology ,Natural Sciences and Mathematics ","50% tuition fee ,100% tuition fee,Full scholarship","How to apply:
- You can apply for a scholarship on the same application form when applying for the Master's Programme.
- You will apply for a scholarship in general, not for a scholarship in a certain category.

Maintain your academic performance:
- All the students granted with a scholarship are required to study full time i.e. complete a minimum of 55 ECTS credits per year to fulfill the scholarship requirements. The progress for studying will be monitored each semester.
- In order to qualify for the scholarship to be granted for the second year, the student must complete a minimum of 55 ECTS credits of studies included in the personal study plan and listed on the Transcript of Records.

A certain number of scholarships for each programme will be granted in the order of the highest points achieved in the academic evaluation during the admission process.",https://www.lut.fi/web/en/admissions/masters-studies/scholarships-and-fees,Change every year,4/9/2017,
